category,explain
Tops,"Upper body garments like shirts, blouses, and T-shirts."
bottoms,"Clothing worn on the lower part of the body, such as pants, skirts, and shorts. "
Jumpsuit,"A one-piece garment that combines a top and pants, creating a streamlined and stylish look. "
Overcoat,A coat worn over other clothing in cold weather.
Dresses, a one-piece garment consisting of a combined top and bottom.
Set,An ensemble consisting of top and bottom or multiple coordinated clothing items for a complete outfit